[
  {
    "body": "some string",
    "body_last_edit_date": 1,
    "excerpt": "some string",
    "excerpt_last_edit_date": 1,
    "last_body_editor": {
      "accept_rate": 1,
      "badge_counts": {
        "bronze": 1,
        "gold": 1,
        "silver": 1
      },
      "display_name": "some string",
      "link": "some string",
      "profile_image": "some string",
      "reputation": 1,
      "user_id": 1,
      "user_type": "some string"
    },
    "last_excerpt_editor": {
      "accept_rate": 1,
      "badge_counts": {
        "bronze": 1,
        "gold": 1,
        "silver": 1
      },
      "display_name": "some string",
      "link": "some string",
      "profile_image": "some string",
      "reputation": 1,
      "user_id": 1,
      "user_type": "some string"
    },
    "tag_name": "some string"
  }
]